<?xml version="1.0"?>
<!DOCTYPE groups SYSTEM "../dtd/groups.dtd">
<groups>
<group id="g1"><name>loro jacksoon</name><admin>u2</admin><created_at>2025-07-15T20:24:45+00:00</created_at><members><member>u1</member><member>u2</member></members><messages></messages></group></groups>
